{"acceptance_criteria":[{"criterion":"El CLI valida Project Profile, Task y registries antes de ejecutar etapas","evidence":"tests/integration/operational-runner.test.js","id":"AC-1"},{"criterion":"OpenSpec se consulta por comandos JSON de solo lectura y su delta entra al contexto","evidence":"tests/adapters/operational.test.js y openspec validate","id":"AC-2"},{"criterion":"El contexto respeta un budget duro y conserva requested included omitted y missing","evidence":"tests/integration/operational-runner.test.js","id":"AC-3"},{"criterion":"El runtime recibe exclusivamente la Task y la evidencia incluida por ContextPackager","evidence":"tests/core/agent-mvp.test.js y tests/core/agent-runtime.test.js","id":"AC-4"},{"criterion":"El modo simulate persiste artifacts eventos idempotentes y RunState sin llamadas pagas","evidence":"tests/integration/operational-runner.test.js","id":"AC-5"},{"criterion":"repo-packager ofrece materializacion exacta JSON sin cache ni npx","evidence":"tests/repo-packager/pack.test.py","id":"AC-6"},{"criterion":"Cada rol habilitado usa una linea zero-cost con invocacion observada, Ox Alpha queda unavailable y HIGH conserva su gate","evidence":"tests/integration/operational-runner.test.js y tests/core/routing.test.js","id":"AC-7"}],"area":"ai_tooling","artifact":"TASK","author_role":"developer","baseline":{"fingerprint_reason":"multi-repository task uses explicit repository revisions","fingerprint_status":"unavailable","revision":"4ac8ce9fffaa4a77e04fce435035f341767d6cf0","working_tree_fingerprint":null},"constraints":["Orca conserva workspace y sesion; Task Lifecycle conserva estados y aceptacion","OpenSpec solo aporta especificaciones y deltas como evidencia","repo-packager materializa; ContextPackager y Explorer deciden suficiencia","FitFlow y Tecnotron-ai usan worktrees emparejados y ownership disjunto","No se agregan dependencias al manifiesto"],"created_at":"2026-08-26T00:00:00Z","document_impact":["openspec/changes/operational-workflow-mvp","Tecnotron-ai current-state and roadmap follow-up after acceptance"],"github_issue":null,"in_scope":["Tecnotron-ai runner y adapters para Task, OpenSpec, repo-packager y RunStore","Entrega del contexto acotado al Agent Runtime","Bootstrap OpenSpec y configuracion consumidora en FitFlow","Modo simulate local sin inferencia ni API","Pruebas y telemetria de contexto correlacionable por run","Linea zero-cost observada por uso, con Planner y Coder Strong A habilitados"],"lane":"ai_orchestrated","objective":"Activar un workflow local determinista que valide la Task, incorpore evidencia OpenSpec de solo lectura, limite el contexto antes del runtime y persista eventos y RunState sin usar APIs pagas.","openspec_change":"operational-workflow-mvp","out_of_scope":["Aceptacion terminal, merge, push o promocion a DONE","Provider o modelo real","Paid API, Temporal, MCP o retrieval semantico","Mutaciones de producto, base de datos o secretos","Automatizacion completa de Orca o GitHub"],"ownership_keys":["path:.ai/tasks/FF-AI-OPS-001/**","path:.ai/runs/FF-AI-OPS-001-*/**","path:openspec/**","config:.ai/config/project-profile.yaml","config:.ai/config/models.yaml","config:.ai/config/finops.yaml","config:.ai/config/roles.yaml","path:FitFlow-ai/src/operational-runner/**","path:FitFlow-ai/src/adapters/**","path:FitFlow-ai/src/project-profile/index.js","path:FitFlow-ai/src/agent-mvp/index.js","path:FitFlow-ai/src/agent-runtime/index.js","path:FitFlow-ai/src/core/run-store.js","path:FitFlow-ai/scripts/workflow/**","path:FitFlow-ai/scripts/doctor/tests/doctor.test.js","path:FitFlow-ai/tests/**","path:FitFlow-ai/.opencode/skills/repo-packager/scripts/pack.py","path:FitFlow-ai/package.json","path:FitFlow-ai/docs/research/temporary-ox-alpha-free-line.md"],"priority":"P0","required_docs":["AGENTS.md","docs/SOURCE_OF_TRUTH.md"],"risk":"medium","schema_version":"fitflow-task/v2","scope":"mixed","status":"EXECUTING","task_id":"FF-AI-OPS-001","task_type":"tooling","title":"Activar el workflow operacional determinista y acotado por contexto","validation_expected":["openspec validate operational-workflow-mvp --strict","python tests/repo-packager/pack.test.py","node --test tests/core tests/adapters tests/integration/operational-runner.test.js","git diff --check"]}